{
  "name": "Default Scene",
  "program_number": 0,
  "send_pc_on_load": true,
  "on_load": [
    {
      "type": "all_notes_off"
    }
  ],
  "touchwheel_mode": "buttons",
  "touchpads": [
    {
      "enabled": true,
      "actions": [
        {
          "type": "send_cc",
          "cc": 1,
          "value": 127
        }
      ]
    },
    {
      "enabled": true,
      "actions": [
        {
          "type": "send_cc",
          "cc": 2,
          "value": 127
        }
      ]
    },
    {
      "enabled": true,
      "actions": [
        {
          "type": "send_cc",
          "cc": 3,
          "value": 127
        }
      ]
    },
    {
      "enabled": true,
      "actions": [
        {
          "type": "send_cc",
          "cc": 4,
          "value": 127
        }
      ]
    },
    {
      "enabled": true,
      "actions": [
        {
          "type": "send_cc",
          "cc": 5,
          "value": 127
        }
      ]
    },
    {
      "enabled": true,
      "actions": [
        {
          "type": "send_cc",
          "cc": 6,
          "value": 127
        }
      ]
    },
    {
      "enabled": true,
      "actions": [
        {
          "type": "send_cc",
          "cc": 7,
          "value": 127
        }
      ]
    },
    {
      "enabled": true,
      "actions": [
        {
          "type": "send_cc",
          "cc": 8,
          "value": 127
        }
      ]
    },
    {
      "enabled": true,
      "actions": [
        {
          "type": "send_cc",
          "cc": 9,
          "value": 127
        }
      ]
    },
    {
      "enabled": true,
      "actions": [
        {
          "type": "send_cc",
          "cc": 10,
          "value": 127
        }
      ]
    },
    {
      "enabled": true,
      "actions": [
        {
          "type": "send_cc",
          "cc": 11,
          "value": 127
        }
      ]
    },
    {
      "enabled": true,
      "actions": [
        {
          "type": "send_cc",
          "cc": 12,
          "value": 127
        }
      ]
    }
  ],
  "button_left": [
    {
      "type": "program_prev"
    }
  ],
  "button_right": [
    {
      "type": "program_next"
    }
  ],
  "button_both": [
    {
      "type": "confirm_pending"
    }
  ],
  "expression": {
    "enabled": false,
    "output_type": "cc",
    "cc_number": 4,
    "base_note": 60,
    "note_range": 24,
    "velocity": 100,
    "curve_type": 0,
    "polarity": 0,
    "min_value": 0,
    "max_value": 127
  },
  "cv": {
    "enabled": false,
    "output_type": "cc",
    "cc_number": 16,
    "base_note": 60,
    "note_range": 24,
    "velocity": 100,
    "curve_type": 0,
    "polarity": 0,
    "min_value": 0,
    "max_value": 127
  },
  "proximity": {
    "enabled": false,
    "output_type": "cc",
    "cc_number": 17,
    "base_note": 60,
    "note_range": 24,
    "velocity": 100,
    "curve_type": 0,
    "polarity": 1,
    "min_value": 0,
    "max_value": 127,
    "use_idle_value": true,
    "idle_value": 64,
    "idle_timeout_ms": 1000
  },
  "als": {
    "enabled": false,
    "output_type": "cc",
    "cc_number": 18,
    "base_note": 60,
    "note_range": 24,
    "velocity": 100,
    "curve_type": 0,
    "polarity": 0,
    "min_value": 0,
    "max_value": 127
  }
}

